{
  "$schema": "http://json-schema.org/draft-07/schema#",
  "$id": "dc-demand-encounter-v1.schema.json",
  "title": "Demand Encounter Contract (DC-DEMAND-ENCOUNTER-v1)",
  "description": "FHIR R4 Encounter (class=IMP) + EncounterStatusHistory aligned demand contract for inpatient hospitalisation planning (Sprint 07).",
  "type": "object",
  "additionalProperties": false,
  "required": [
    "datasetId", "contractId", "contractVersion",
    "classification", "residency", "purposeTags", "records"
  ],
  "properties": {
    "datasetId":        { "type": "string", "pattern": "^DS-DEMAND-ENC-[a-z0-9-]+$" },
    "contractId":       { "type": "string", "enum": ["DC-DEMAND-ENCOUNTER-v1"] },
    "contractVersion":  { "type": "string", "pattern": "^[0-9]+\\.[0-9]+\\.[0-9]+$" },
    "classification":   { "type": "string", "enum": ["operational-confidential"] },
    "residency":        { "type": "string", "enum": ["CH"] },
    "purposeTags": {
      "type": "array",
      "minItems": 1,
      "items": { "type": "string", "enum": ["capacity-planning", "bed-management"] }
    },
    "purposeTags":      { "type": "array", "minItems": 1, "items": { "type": "string", "enum": ["capacity-planning", "bed-management"] } },
    "records": {
      "type": "array",
      "minItems": 1,
      "items": {
        "type": "object",
        "additionalProperties": false,
        "required": [
          "contractId", "encounterId", "pseudonymId", "organizationId",
          "class", "status", "admissionType", "requestedSpecialtyServiceId",
          "acuityBand", "expectedArrivalTimestamp", "expectedLOSDays",
          "statusHistory", "purposeTag", "dataResidencyRegion", "asOfTimestamp"
        ],
        "properties": {
          "contractId":                  { "type": "string", "enum": ["DC-DEMAND-ENCOUNTER-v1"] },
          "encounterId":                 { "type": "string", "pattern": "^ENC-[0-9]{4}-[0-9]{4,}$" },
          "pseudonymId":                 { "type": "string", "pattern": "^PID-[A-F0-9]{8}$" },
          "organizationId":              { "type": "string", "pattern": "^ORG-[A-Z0-9-]+$" },
          "class":                       { "type": "string", "enum": ["IMP"] },
          "status":                      { "type": "string", "enum": ["planned", "arrived", "triaged", "in-progress", "onleave", "finished", "cancelled"] },
          "admissionType":               { "type": "string", "enum": ["emergency", "elective", "transfer", "observation"] },
          "requestedSpecialtyServiceId": { "type": "string", "pattern": "^HCS-[A-Z0-9-]+$" },
          "requiredCharacteristics": {
            "type": "array",
            "items": { "type": "string", "enum": [
              "isolation", "cardiac-monitoring", "negative-pressure",
              "bariatric", "single-room", "pediatric-equipped",
              "female-only", "male-only"
            ]}
          },
          "acuityBand":                  { "type": "string", "enum": ["routine", "urgent", "asap", "stat"] },
          "expectedArrivalTimestamp":    { "type": "string", "format": "date-time" },
          "expectedLOSDays":             { "type": "integer", "minimum": 1, "maximum": 365 },
          "expectedDischargeTimestamp":  { "type": "string", "format": "date-time" },
          "statusHistory": {
            "type": "array",
            "minItems": 1,
            "items": {
              "type": "object",
              "additionalProperties": false,
              "required": ["status", "periodStart", "periodEnd"],
              "properties": {
                "status":      { "type": "string", "enum": ["planned", "arrived", "triaged", "in-progress", "onleave", "finished", "cancelled"] },
                "periodStart": { "type": "string", "format": "date-time" },
                "periodEnd":   { "type": ["string", "null"], "format": "date-time" },
                "locationId":  { "type": ["string", "null"], "pattern": "^LOC-[A-Z0-9-]+$" }
              }
            }
          },
          "purposeTag":          { "type": "string", "enum": ["capacity-planning", "bed-management"] },
          "dataResidencyRegion": { "type": "string", "enum": ["switzerlandnorth", "switzerlandwest"] },
          "asOfTimestamp":       { "type": "string", "format": "date-time" },
          "extensions":          { "type": "object" }
        }
      }
    }
  }
}
