{
  "datasetId": "DS-DEMAND-ENC-sit-2026-06-12",
  "contractId": "DC-DEMAND-ENCOUNTER-v1",
  "contractVersion": "1.0.0",
  "classification": "operational-confidential",
  "residency": "CH",
  "records": [
    {
      "contractId": "DC-DEMAND-ENCOUNTER-v1",
      "encounterId": "ENC-2026-0001",
      "pseudonymId": "PID-3103A465",
      "organizationId": "ORG-HIRSLANDEN",
      "class": "IMP",
      "status": "in-progress",
      "admissionType": "transfer",
      "requestedSpecialtyServiceId": "HCS-ONCOLOGY-0205",
      "requiredCharacteristics": [],
      "acuityBand": "routine",
      "expectedArrivalTimestamp": "2026-06-19T08:37:00Z",
      "expectedLOSDays": 9,
      "statusHistory": [
        {
          "status": "planned",
          "periodStart": "2026-06-17T08:37:00Z",
          "periodEnd": "2026-06-19T08:37:00Z",
          "locationId": null
        },
        {
          "status": "in-progress",
          "periodStart": "2026-06-19T08:46:00Z",
          "periodEnd": null,
          "locationId": null
        }
      ],
      "purposeTag": "bed-management",
      "dataResidencyRegion": "switzerlandnorth",
      "asOfTimestamp": "2026-06-12T08:00:00Z"
    },
    {
      "contractId": "DC-DEMAND-ENCOUNTER-v1",
      "encounterId": "ENC-2026-0002",
      "pseudonymId": "PID-C2CB314B",
      "organizationId": "ORG-HIRSLANDEN",
      "class": "IMP",
      "status": "finished",
      "admissionType": "transfer",
      "requestedSpecialtyServiceId": "HCS-REHAB-0106",
      "requiredCharacteristics": [],
      "acuityBand": "routine",
      "expectedArrivalTimestamp": "2026-06-23T07:42:00Z",
      "expectedLOSDays": 4,
      "statusHistory": [
        {
          "status": "planned",
          "periodStart": "2026-06-21T07:42:00Z",
          "periodEnd": "2026-06-23T07:42:00Z",
          "locationId": null
        },
        {
          "status": "in-progress",
          "periodStart": "2026-06-23T07:56:00Z",
          "periodEnd": "2026-06-26T15:56:00Z",
          "locationId": null
        },
        {
          "status": "finished",
          "periodStart": "2026-06-26T15:56:00Z",
          "periodEnd": null,
          "locationId": null
        }
      ],
      "purposeTag": "bed-management",
      "dataResidencyRegion": "switzerlandnorth",
      "asOfTimestamp": "2026-06-12T08:00:00Z"
    },
    {
      "contractId": "DC-DEMAND-ENCOUNTER-v1",
      "encounterId": "ENC-2026-0003",
      "pseudonymId": "PID-63B54ED8",
      "organizationId": "ORG-HIRSLANDEN",
      "class": "IMP",
      "status": "in-progress",
      "admissionType": "elective",
      "requestedSpecialtyServiceId": "HCS-CARDIOLOGY-0101",
      "requiredCharacteristics": [
        "isolation"
      ],
      "acuityBand": "routine",
      "expectedArrivalTimestamp": "2026-06-25T07:45:00Z",
      "expectedLOSDays": 3,
      "statusHistory": [
        {
          "status": "planned",
          "periodStart": "2026-06-23T07:45:00Z",
          "periodEnd": "2026-06-25T07:45:00Z",
          "locationId": null
        },
        {
          "status": "in-progress",
          "periodStart": "2026-06-25T07:45:00Z",
          "periodEnd": null,
          "locationId": null
        }
      ],
      "purposeTag": "capacity-planning",
      "dataResidencyRegion": "switzerlandnorth",
      "asOfTimestamp": "2026-06-12T08:00:00Z"
    },
    {
      "contractId": "DC-DEMAND-ENCOUNTER-v1",
      "encounterId": "ENC-2026-0004",
      "pseudonymId": "PID-37297D0B",
      "organizationId": "ORG-ZOLLIKERBERG",
      "class": "IMP",
      "status": "in-progress",
      "admissionType": "transfer",
      "requestedSpecialtyServiceId": "HCS-INTERNAL-MED-0203",
      "requiredCharacteristics": [],
      "acuityBand": "urgent",
      "expectedArrivalTimestamp": "2026-06-23T12:56:00Z",
      "expectedLOSDays": 7,
      "statusHistory": [
        {
          "status": "planned",
          "periodStart": "2026-06-21T12:56:00Z",
          "periodEnd": "2026-06-23T12:56:00Z",
          "locationId": null
        },
        {
          "status": "in-progress",
          "periodStart": "2026-06-23T13:24:00Z",
          "periodEnd": null,
          "locationId": null
        }
      ],
      "purposeTag": "bed-management",
      "dataResidencyRegion": "switzerlandnorth",
      "asOfTimestamp": "2026-06-12T08:00:00Z"
    },
    {
      "contractId": "DC-DEMAND-ENCOUNTER-v1",
      "encounterId": "ENC-2026-0005",
      "pseudonymId": "PID-67C9B5CF",
      "organizationId": "ORG-HIRSLANDEN",
      "class": "IMP",
      "status": "in-progress",
      "admissionType": "transfer",
      "requestedSpecialtyServiceId": "HCS-REHAB-0106",
      "requiredCharacteristics": [
        "isolation"
      ],
      "acuityBand": "stat",
      "expectedArrivalTimestamp": "2026-06-16T04:48:00Z",
      "expectedLOSDays": 12,
      "statusHistory": [
        {
          "status": "planned",
          "periodStart": "2026-06-14T04:48:00Z",
          "periodEnd": "2026-06-16T04:48:00Z",
          "locationId": null
        },
        {
          "status": "in-progress",
          "periodStart": "2026-06-16T04:57:00Z",
          "periodEnd": null,
          "locationId": null
        }
      ],
      "purposeTag": "capacity-planning",
      "dataResidencyRegion": "switzerlandnorth",
      "asOfTimestamp": "2026-06-12T08:00:00Z"
    },
    {
      "contractId": "DC-DEMAND-ENCOUNTER-v1",
      "encounterId": "ENC-2026-0006",
      "pseudonymId": "PID-E3485BBB",
      "organizationId": "ORG-ZOLLIKERBERG",
      "class": "IMP",
      "status": "in-progress",
      "admissionType": "elective",
      "requestedSpecialtyServiceId": "HCS-REHAB-0206",
      "requiredCharacteristics": [
        "isolation"
      ],
      "acuityBand": "urgent",
      "expectedArrivalTimestamp": "2026-06-15T23:33:00Z",
      "expectedLOSDays": 7,
      "statusHistory": [
        {
          "status": "planned",
          "periodStart": "2026-06-13T23:33:00Z",
          "periodEnd": "2026-06-15T23:33:00Z",
          "locationId": null
        },
        {
          "status": "in-progress",
          "periodStart": "2026-06-15T23:33:00Z",
          "periodEnd": null,
          "locationId": null
        }
      ],
      "purposeTag": "capacity-planning",
      "dataResidencyRegion": "switzerlandnorth",
      "asOfTimestamp": "2026-06-12T08:00:00Z"
    },
    {
      "contractId": "DC-DEMAND-ENCOUNTER-v1",
      "encounterId": "ENC-2026-0007",
      "pseudonymId": "PID-8F295DCE",
      "organizationId": "ORG-HIRSLANDEN",
      "class": "IMP",
      "status": "in-progress",
      "admissionType": "elective",
      "requestedSpecialtyServiceId": "HCS-CARDIOLOGY-0101",
      "requiredCharacteristics": [],
      "acuityBand": "routine",
      "expectedArrivalTimestamp": "2026-06-22T00:08:00Z",
      "expectedLOSDays": 4,
      "statusHistory": [
        {
          "status": "planned",
          "periodStart": "2026-06-20T00:08:00Z",
          "periodEnd": "2026-06-22T00:08:00Z",
          "locationId": null
        },
        {
          "status": "in-progress",
          "periodStart": "2026-06-22T00:36:00Z",
          "periodEnd": null,
          "locationId": null
        }
      ],
      "purposeTag": "bed-management",
      "dataResidencyRegion": "switzerlandnorth",
      "asOfTimestamp": "2026-06-12T08:00:00Z"
    },
    {
      "contractId": "DC-DEMAND-ENCOUNTER-v1",
      "encounterId": "ENC-2026-0008",
      "pseudonymId": "PID-BF3460F5",
      "organizationId": "ORG-ZOLLIKERBERG",
      "class": "IMP",
      "status": "in-progress",
      "admissionType": "elective",
      "requestedSpecialtyServiceId": "HCS-ORTHOPEDICS-0102",
      "requiredCharacteristics": [
        "cardiac-monitoring"
      ],
      "acuityBand": "asap",
      "expectedArrivalTimestamp": "2026-06-18T19:52:00Z",
      "expectedLOSDays": 6,
      "statusHistory": [
        {
          "status": "planned",
          "periodStart": "2026-06-16T19:52:00Z",
          "periodEnd": "2026-06-18T19:52:00Z",
          "locationId": null
        },
        {
          "status": "in-progress",
          "periodStart": "2026-06-18T20:03:00Z",
          "periodEnd": null,
          "locationId": null
        }
      ],
      "purposeTag": "capacity-planning",
      "dataResidencyRegion": "switzerlandnorth",
      "asOfTimestamp": "2026-06-12T08:00:00Z"
    },
    {
      "contractId": "DC-DEMAND-ENCOUNTER-v1",
      "encounterId": "ENC-2026-0009",
      "pseudonymId": "PID-7DB36BEC",
      "organizationId": "ORG-ZOLLIKERBERG",
      "class": "IMP",
      "status": "finished",
      "admissionType": "transfer",
      "requestedSpecialtyServiceId": "HCS-NEUROLOGY-0104",
      "requiredCharacteristics": [],
      "acuityBand": "routine",
      "expectedArrivalTimestamp": "2026-06-23T02:54:00Z",
      "expectedLOSDays": 7,
      "statusHistory": [
        {
          "status": "planned",
          "periodStart": "2026-06-21T02:54:00Z",
          "periodEnd": "2026-06-23T02:54:00Z",
          "locationId": null
        },
        {
          "status": "in-progress",
          "periodStart": "2026-06-23T03:02:00Z",
          "periodEnd": "2026-06-23T22:02:00Z",
          "locationId": null
        },
        {
          "status": "finished",
          "periodStart": "2026-06-23T22:02:00Z",
          "periodEnd": null,
          "locationId": null
        }
      ],
      "purposeTag": "capacity-planning",
      "dataResidencyRegion": "switzerlandnorth",
      "asOfTimestamp": "2026-06-12T08:00:00Z"
    },
    {
      "contractId": "DC-DEMAND-ENCOUNTER-v1",
      "encounterId": "ENC-2026-0010",
      "pseudonymId": "PID-4356DE02",
      "organizationId": "ORG-ZOLLIKERBERG",
      "class": "IMP",
      "status": "in-progress",
      "admissionType": "elective",
      "requestedSpecialtyServiceId": "HCS-REHAB-0206",
      "requiredCharacteristics": [
        "single-room"
      ],
      "acuityBand": "routine",
      "expectedArrivalTimestamp": "2026-06-17T10:25:00Z",